public/data/outputs/state/univariate_stats.json

{
  "pobreza_pct": {
    "count": 32,
    "mean": 34.5411,
    "std": 14.929,
    "min": 13.329,
    "q25": 21.6925,
    "q50": 33.6727,
    "q75": 44.4443,
    "max": 67.3708,
    "skewness": 0.4202,
    "kurtosis": -0.8112
  },
  "pobreza_extrema_pct": {
    "count": 32,
    "mean": 6.5337,
    "std": 6.558,
    "min": 0.7617,
    "q25": 1.7868,
    "q50": 5.3646,
    "q75": 7.441,
    "max": 28.2125,
    "skewness": 1.9005,
    "kurtosis": 3.621
  },
  "vulnerable_carencias_pct": {
    "count": 32,
    "mean": 30.516,
    "std": 5.022,
    "min": 20.9559,
    "q25": 26.7404,
    "q50": 30.0082,
    "q75": 35.5635,
    "max": 38.0503,
    "skewness": -0.0242,
    "kurtosis": -1.0473
  },
  "no_pobre_no_vulnerable_pct": {
    "count": 32,
    "mean": 28.0401,
    "std": 11.7895,
    "min": 8.0717,
    "q25": 17.2031,
    "q50": 27.814,
    "q75": 37.7125,
    "max": 47.0562,
    "skewness": 0.0111,
    "kurtosis": -1.2139
  },
  "rezago_educativo_pct": {
    "count": 32,
    "mean": 19.2007,
    "std": 5.0572,
    "min": 9.6995,
    "q25": 16.0938,
    "q50": 17.883,
    "q75": 20.8487,
    "max": 31.1069,
    "skewness": 0.8227,
    "kurtosis": 0.3607
  },
  "carencia_salud_pct": {
    "count": 32,
    "mean": 36.5047,
    "std": 12.6347,
    "min": 17.3367,
    "q25": 27.6046,
    "q50": 34.3195,
    "q75": 45.535,
    "max": 66.0662,
    "skewness": 0.688,
    "kurtosis": -0.0583
  },
  "carencia_servicios_basicos_pct": {
    "count": 32,
    "mean": 18.1413,
    "std": 16.11,
    "min": 2.4658,
    "q25": 6.3043,
    "q50": 9.69,
    "q75": 25.1163,
    "max": 55.1704,
    "skewness": 1.1034,
    "kurtosis": 0.0738
  },
  "ingreso_inferior_lp_pct": {
    "count": 32,
    "mean": 41.4439,
    "std": 14.1681,
    "min": 17.8933,
    "q25": 29.0724,
    "q50": 41.8183,
    "q75": 51.5056,
    "max": 70.0396,
    "skewness": 0.2512,
    "kurtosis": -0.9427
  },
  "pib_total": {
    "count": 32,
    "mean": 792663.1454,
    "std": 778044.4477,
    "min": 151512.669,
    "q25": 327016.563,
    "q50": 547010.873,
    "q75": 924428.3692,
    "max": 3885956.593,
    "skewness": 2.521,
    "kurtosis": 7.5731
  },
  "pib_per_capita": {
    "count": 32,
    "mean": 206.6503,
    "std": 94.1439,
    "min": 70.3115,
    "q25": 137.2086,
    "q50": 197.6058,
    "q75": 249.4352,
    "max": 509.9293,
    "skewness": 1.4117,
    "kurtosis": 2.7105
  },
  "poblacion_total": {
    "count": 32,
    "mean": 3937938.25,
    "std": 3278009.0925,
    "min": 731391.0,
    "q25": 1851651.25,
    "q50": 3054892.0,
    "q75": 4947591.5,
    "max": 16992418.0,
    "skewness": 2.3143,
    "kurtosis": 7.2338
  },
  "poblacion_edad_laboral_pct": {
    "count": 32,
    "mean": 66.1204,
    "std": 2.3233,
    "min": 61.2731,
    "q25": 65.1082,
    "q50": 66.054,
    "q75": 67.4301,
    "max": 70.8521,
    "skewness": -0.1725,
    "kurtosis": -0.0243
  },
  "poblacion_economicamente_activa_pct": {
    "count": 32,
    "mean": 49.2653,
    "std": 2.8458,
    "min": 43.2165,
    "q25": 48.1326,
    "q50": 49.2178,
    "q75": 50.4224,
    "max": 55.3745,
    "skewness": 0.0118,
    "kurtosis": 0.1103
  },
  "poblacion_afiliada_imss_pct": {
    "count": 32,
    "mean": 38.6854,
    "std": 14.3448,
    "min": 12.1339,
    "q25": 27.4423,
    "q50": 40.0964,
    "q75": 49.8081,
    "max": 66.2808,
    "skewness": -0.1554,
    "kurtosis": -0.7911
  },
  "personas_usuarias_computadora_pct": {
    "count": 32,
    "mean": 36.5275,
    "std": 6.3805,
    "min": 23.5,
    "q25": 32.6025,
    "q50": 37.895,
    "q75": 40.62,
    "max": 52.76,
    "skewness": -0.1626,
    "kurtosis": 0.4821
  },
  "personas_usuarias_internet_pct": {
    "count": 32,
    "mean": 83.7078,
    "std": 5.7542,
    "min": 64.92,
    "q25": 82.4325,
    "q50": 85.025,
    "q75": 87.74,
    "max": 91.34,
    "skewness": -1.6059,
    "kurtosis": 3.2474
  },
  "personas_conexion_internet_movil_pct": {
    "count": 32,
    "mean": 50.1509,
    "std": 7.9164,
    "min": 33.3,
    "q25": 43.5325,
    "q50": 53.4,
    "q75": 54.67,
    "max": 67.11,
    "skewness": -0.2548,
    "kurtosis": -0.2559
  },
  "personas_usan_redes_sociales_pct": {
    "count": 32,
    "mean": 75.8734,
    "std": 5.9938,
    "min": 57.44,
    "q25": 73.675,
    "q50": 76.605,
    "q75": 79.4275,
    "max": 86.45,
    "skewness": -1.236,
    "kurtosis": 2.4279
  },
  "personas_compras_internet_pct": {
    "count": 32,
    "mean": 30.7778,
    "std": 6.8354,
    "min": 14.85,
    "q25": 26.7125,
    "q50": 30.72,
    "q75": 36.9925,
    "max": 40.01,
    "skewness": -0.441,
    "kurtosis": -0.605
  },
  "personas_pagos_internet_pct": {
    "count": 32,
    "mean": 27.8897,
    "std": 6.5478,
    "min": 13.64,
    "q25": 23.4775,
    "q50": 27.775,
    "q75": 33.21,
    "max": 39.68,
    "skewness": -0.267,
    "kurtosis": -0.764
  },
  "personas_banca_electronica_pct": {
    "count": 32,
    "mean": 14.6181,
    "std": 6.488,
    "min": 4.5,
    "q25": 9.1025,
    "q50": 13.37,
    "q75": 18.405,
    "max": 29.2,
    "skewness": 0.5548,
    "kurtosis": -0.3666
  },
  "personas_con_celular_pct": {
    "count": 32,
    "mean": 83.525,
    "std": 5.9808,
    "min": 63.09,
    "q25": 81.1925,
    "q50": 84.55,
    "q75": 87.49,
    "max": 92.24,
    "skewness": -1.5007,
    "kurtosis": 3.3992
  },
  "personas_usuarias_celular_pct": {
    "count": 32,
    "mean": 87.3653,
    "std": 4.1739,
    "min": 73.17,
    "q25": 86.245,
    "q50": 88.08,
    "q75": 90.1025,
    "max": 93.08,
    "skewness": -1.8468,
    "kurtosis": 4.6564
  },
  "personas_con_smartphone_pct": {
    "count": 32,
    "mean": 84.42,
    "std": 4.6424,
    "min": 68.04,
    "q25": 83.13,
    "q50": 85.215,
    "q75": 86.99,
    "max": 91.05,
    "skewness": -1.7634,
    "kurtosis": 4.6871
  },
  "personas_conexion_datos_celular_pct": {
    "count": 32,
    "mean": 66.2519,
    "std": 7.2029,
    "min": 46.84,
    "q25": 62.56,
    "q50": 67.545,
    "q75": 70.0025,
    "max": 81.24,
    "skewness": -0.8151,
    "kurtosis": 1.3758
  },
  "personas_usan_apps_redes_sociales_pct": {
    "count": 32,
    "mean": 64.5475,
    "std": 6.2743,
    "min": 47.01,
    "q25": 61.4275,
    "q50": 65.53,
    "q75": 67.8175,
    "max": 77.88,
    "skewness": -0.8399,
    "kurtosis": 1.3954
  },
  "personas_usan_banca_movil_pct": {
    "count": 32,
    "mean": 27.7697,
    "std": 6.9987,
    "min": 15.52,
    "q25": 22.73,
    "q50": 28.425,
    "q75": 33.105,
    "max": 40.84,
    "skewness": -0.0306,
    "kurtosis": -0.9839
  },
  "teledensidad_internet_movil": {
    "count": 32,
    "mean": 103.6562,
    "std": 11.9613,
    "min": 70.0,
    "q25": 97.0,
    "q50": 106.5,
    "q75": 109.0,
    "max": 128.0,
    "skewness": -0.7388,
    "kurtosis": 1.6139
  },
  "localidades_con_cobertura_movil_pct": {
    "count": 32,
    "mean": 86.8462,
    "std": 12.0797,
    "min": 51.83,
    "q25": 82.6675,
    "q50": 89.56,
    "q75": 95.25,
    "max": 99.83,
    "skewness": -1.2997,
    "kurtosis": 1.3819
  },
  "poblacion_en_localidades_con_cobertura_movil_pct": {
    "count": 32,
    "mean": 97.9016,
    "std": 2.4407,
    "min": 91.97,
    "q25": 97.145,
    "q50": 98.86,
    "q75": 99.5925,
    "max": 100.0,
    "skewness": -1.3764,
    "kurtosis": 0.6472
  },
  "localidades_con_4g_garantizada_pct": {
    "count": 32,
    "mean": 79.6353,
    "std": 15.1473,
    "min": 42.46,
    "q25": 72.87,
    "q50": 81.615,
    "q75": 89.6725,
    "max": 98.61,
    "skewness": -0.9778,
    "kurtosis": 0.4581
  },
  "poblacion_en_localidades_con_4g_garantizada_pct": {
    "count": 32,
    "mean": 96.85,
    "std": 3.1273,
    "min": 89.89,
    "q25": 94.915,
    "q50": 98.1,
    "q75": 99.215,
    "max": 100.0,
    "skewness": -1.0551,
    "kurtosis": -0.0405
  },
  "localidades_con_5g_garantizada_pct": {
    "count": 32,
    "mean": 4.9359,
    "std": 3.5433,
    "min": 0.07,
    "q25": 1.9225,
    "q50": 4.365,
    "q75": 7.21,
    "max": 14.44,
    "skewness": 0.8383,
    "kurtosis": 0.2262
  },
  "poblacion_en_localidades_con_5g_garantizada_pct": {
    "count": 32,
    "mean": 55.8859,
    "std": 21.1001,
    "min": 19.95,
    "q25": 41.7475,
    "q50": 54.665,
    "q75": 74.705,
    "max": 92.84,
    "skewness": -0.0473,
    "kurtosis": -0.9605
  },
  "hogares_en_localidades_con_internet_pct": {
    "count": 32,
    "mean": 84.9162,
    "std": 12.1432,
    "min": 56.2,
    "q25": 78.5125,
    "q50": 87.35,
    "q75": 93.93,
    "max": 99.9,
    "skewness": -0.9006,
    "kurtosis": -0.1134
  },
  "poblacion_en_localidades_con_internet_pct": {
    "count": 32,
    "mean": 83.8028,
    "std": 12.8127,
    "min": 53.35,
    "q25": 77.5175,
    "q50": 86.09,
    "q75": 93.3525,
    "max": 99.88,
    "skewness": -0.8931,
    "kurtosis": -0.0834
  }
}

data/processed/endutih_2024_data_quality_report.md

## Perfil de metricas

- personas_usuarias_computadora_pct: min 23.5, max 52.76, media 36.53, desv_est 6.28
- personas_usuarias_internet_pct: min 64.92, max 91.34, media 83.71, desv_est 5.66
- personas_conexion_internet_movil_pct: min 33.3, max 67.11, media 50.15, desv_est 7.79
- personas_usan_redes_sociales_pct: min 57.44, max 86.45, media 75.87, desv_est 5.9
- personas_compras_internet_pct: min 14.85, max 40.01, media 30.78, desv_est 6.73
- personas_pagos_internet_pct: min 13.64, max 39.68, media 27.89, desv_est 6.44
- personas_banca_electronica_pct: min 4.5, max 29.2, media 14.62, desv_est 6.39
- personas_con_celular_pct: min 63.09, max 92.24, media 83.53, desv_est 5.89
- personas_usuarias_celular_pct: min 73.17, max 93.08, media 87.37, desv_est 4.11
- personas_con_smartphone_pct: min 68.04, max 91.05, media 84.42, desv_est 4.57
- personas_conexion_datos_celular_pct: min 46.84, max 81.24, media 66.25, desv_est 7.09
- personas_usan_apps_redes_sociales_pct: min 47.01, max 77.88, media 64.55, desv_est 6.18
- personas_usan_banca_movil_pct: min 15.52, max 40.84, media 27.77, desv_est 6.89
- teledensidad_internet_movil: min 70.0, max 128.0, media 103.66, desv_est 11.77
- localidades_con_cobertura_movil_pct: min 51.83, max 99.83, media 86.85, desv_est 11.89
- poblacion_en_localidades_con_cobertura_movil_pct: min 91.97, max 100.0, media 97.9, desv_est 2.4
- localidades_con_4g_garantizada_pct: min 42.46, max 98.61, media 79.64, desv_est 14.91
- poblacion_en_localidades_con_4g_garantizada_pct: min 89.89, max 100.0, media 96.85, desv_est 3.08
- localidades_con_5g_garantizada_pct: min 0.07, max 14.44, media 4.94, desv_est 3.49
- poblacion_en_localidades_con_5g_garantizada_pct: min 19.95, max 92.84, media 55.89, desv_est 20.77
- hogares_en_localidades_con_internet_pct: min 56.2, max 99.9, media 84.92, desv_est 11.95
- poblacion_en_localidades_con_internet_pct: min 53.35, max 99.88, media 83.8, desv_est 12.61